Venue,Review ID,review,Tone,Review URL,,,Venue,Review ID,review,Tone,Review URL,,,Venue,Review ID,review,Tone,Review URL
 ShitMyReviews,,"Line 156-160; this is the only correct, sensible and interesting finding of the paper.",3,,,,,,,,,,,,,,,
 ShitMyReviews,,"Returning to the introduction, the study rationale is unclear, the exact research question to be addressed poorly delineated and the overall motivation for the study poorly linked to the literature summary and aims of the study.",4,,,,,,,,,,,,,,,
Publons,ITEES-20-1671.R1,The current version of paper is suitable for the further processes of publication.,4,https://publons.com/wos-op/review/10334908,,,,,,,,,,,,,,
ICLR,ryykVe-0W_R3,Two methods are proposed for drawing samples from the products of marginals .,3,,,,,,,,,,,,,,,
ICLR,rytstxWAW_R1,"In the probabilistic framework defined by the authors it is impossible to cover domain of P , unless whole V is observed .",3,,,,,,,,,,,,,,,
ICLR,HytSvlWRZ_R1,"Differently from previous applications of machine learning in neurodegeneration modeling , the proposed approach models the clinical data accounting for the bounded nature of cognitive tests scores .",4,,,,,,,,,,,,,,,
 ShitMyReviews,,You were either in a rush or you do not care too much about getting your paper accepted,2,,,,,,,,,,,,,,,
ICLR,B1EVwkqTW_R2,I am not sure why you do not evaluate on mini imagenet as well as most work on few shot learning generally do .,2,,,,,,,,,,,,,,,
ICLR,ryserbZR-_R1,"So , the main contribution here , is to adapt min max MIL to the histology domain .",3,,,,,,,,,,,,,,,
 ShitMyReviews,,"This is clearly a submission that needs to be shredded, burned, and the ashes buried in multiple locations",1,,,,,,,,,,,,,,,
 ShitMyReviews,,This paper is written.,3,,,,,,,,,,,,,,,
ICLR,rytstxWAW_R1,I would appreciate if authors were more upfront about the challenges of the problem they formulated and limitations of their results .,4,,,,,,,,,,,,,,,
ICLR,HymuJz-A-_R2,Quality : Im intrigued by but a little uncomfortable with the generalization metrics that the authors use .,2,,,,,,,,,,,,,,,
ICLR,BJDEbngCZ_R2,""" I find this paper not suitable for ICLR .",4,,,,,,,,,,,,,,,
ICLR,HylgYB3pZ_R3,"In Figure ( 7 ) , LCW seems to avoid gradient vanishing but introduces gradient exploding problem .",3,,,,,,,,,,,,,,,
ICLR,rk3pnae0b_R2,"However , as I pointed out above , there are several weaknesses in the paper .",3,,,,,,,,,,,,,,,
 ShitMyReviews,,I do not believe or trust the data presented or the underlying thesis.,2,,,,,,,,,,,,,,,
ICLR,SySpa-Z0Z_R1,A couple of things that could be improved : - The abstract claims to ground the ANR in the variational dropout framework .,4,,,,,,,,,,,,,,,
 ShitMyReviews,,I suggest you consult a competent statistical advisor.,2,,,,,,,,,,,,,,,
ICLR,SyUkxxZ0b_R1,"Also , the term epsilon norm ball is not commonly used in adversarial literature , and the only reference to such papers is Madry et al , ( 2017 ) , which is only on Ar Xiv and not widely known if these types of adversarial examples are often studied as claimed , there should be other / more established references to cite here .",3,,,,,,,,,,,,,,,
Publons,IGJPS-2020-MSA-0332,minor corrections may be required.,3,https://publons.com/wos-op/review/7699619,,,,,,,,,,,,,,
ICLR,B16yEqkCZ_R1,"The paper also does not compare to any other techniques that attempt to deal with catastrophic forgetting and/or the changing state distribution ( [ 1,2 ] ) .",3,,,,,,,,,,,,,,,
Publons,JCOP-21-038.R1,The manuscript incorporates the requirements indicated in the first evaluation. I consider that it is in publication conditions,3,https://publons.com/wos-op/review/11795381,,,,,,,,,,,,,,
ICLR,Hyp3i2xRb_R3,It also achieves a very good performance on sequential and permuted MNIST and achieves SOTA performance on b Ab I .,4,,,,,,,,,,,,,,,
 ShitMyReviews,,Also more information is needed for the reader to be able the information on the standardized changes that is presented afterwards.,3,,,,,,,,,,,,,,,
NIPS,342,"The authors investigate the problem of graph reconstruction via random walks when partial information about node similarities is observed. The problem is very interesting from a data privacy perspective. The paper is well-written, clearly organized, and interesting. Having said that, I am not very well versed in the graph reconstruction or privacy literature, and feel that I cannot comment on the significance or originality of the work.",2,,,,,,,,,,,,,,,
ICLR,B1Gi6LeRZ_R2,The usefulness of the BC technique is proven to a certain extent ( see paragraph below ) but there is not comparison with state of the art .,3,,,,,,,,,,,,,,,
ICLR,HytSvlWRZ_R3,"3 . In synthetic data experiments ( Table1 ) , only small margins could be observed between SN , f MLP and rf MLP , and only Layer 1 of SN performs better above all others .",3,,,,,,,,,,,,,,,
ICLR,ryserbZR-_R3,"I would assume that experimental conditions ( training data , preprocessing , optimization , size of ensemble ) are kept constant in between those two comparisons ?",2,,,,,,,,,,,,,,,
 ShitMyReviews,,A classic instance of reinvention of the square wheel.,2,,,,,,,,,,,,,,,